id;name;feedbackdate;title;content;state;imageurl;creator;createdate;modifier;modifierdate;modifiernum;logicdelete;other
1;intuitive eyeballs Health;4th generation;SCSI Stand-alone;deposit SMTP;hardware Dynamic XML;circuit;Technician bypassing;compress multi-byte protocol;Refined Agent task-force;neural Dong Industrial;46582;false;Incredible Cotton Gloves Frozen
2;National;redundant Alabama architecture;core Books;reboot;application alliance;connecting;Toys Web;AI Maryland;Tasty Metal Cheese system;panel incubate Organic;59685;true;cultivate harness Home Loan Account
3;turquoise Architect;Borders SAS Road;Home Loan Account Tasty Granite Bacon Indian Rupee Ngultrum;PCI Tasty Corporate;Avon Pakistan Rupee;Technician Gorgeous Rubber Keyboard calculate;Investment Account Mouse protocol;North Dakota Street;Car Clothing auxiliary;Chicken Street;45487;true;Interactions New Zealand Cambridgeshire
4;GB New Hampshire;motivating Senior Pennsylvania;Fantastic Checking Account;Movies communities Unbranded;Personal Loan Account Team-oriented;payment tan JBOD;Czech Koruna scale virtual;back-end Manager Electronics;Nuevo Sol Personal Loan Account Investment Account;synthesizing Rustic Plastic Pants Practical Frozen Shirt;81697;true;Chief architecture Honduras
5;Practical Concrete Mouse Multi-layered Causeway;Security;Table;Virgin Islands, British;hack Executive synergies;Bacon;migration;white;Fresh;viral;35369;true;Tasty Concrete Mouse
6;Corporate navigate Refined;Ball Ergonomic Buckinghamshire;hard drive;back-end Granite;haptic budgetary management;Checking Account;Shoes;Practical Way Graphic Interface;protocol full-range bleeding-edge;array;57428;true;Consultant invoice orange
7;British Indian Ocean Territory (Chagos Archipelago);Wyoming reboot Identity;sky blue;Run withdrawal;Buckinghamshire quantifying;Fresh redundant;open system;deliverables Avon;cyan Creative Hat;hard drive Berkshire;86960;true;Virtual Ukraine
8;calculate bifurcated;Texas;Ball;tan Shirt programming;Personal Loan Account;Designer Maine;cross-platform;solid state;Senior efficient;generating cross-platform Chips;67276;false;Down-sized
9;EXE Persevering;back up;HDD auxiliary;unleash Decentralized;Oval;blue human-resource;Chief;Response;azure Seamless;Mississippi Health input;70248;false;Buckinghamshire convergence
10;matrix Accounts;repurpose indexing;Kwanza;green world-class Bedfordshire;European Unit of Account 9(E.U.A.-9) Mission;Avon Generic Steel Ball Swaziland;Configuration Officer;Shoes Field Fundamental;Route;Frozen Savings Account upward-trending;17349;true;Auto Loan Account maroon
