id;type;content;create_date;creator;modifier;modifierdate;modifiernum;title;status
1;incremental;Forward;Internal impactful copy;program Concrete invoice;utilize impactful;Central;26741;open-source;matrix
2;Cambridgeshire French Polynesia Configuration;PNG compress Frozen;Tasty SMTP flexibility;Buckinghamshire;Open-architected Cross-group;application;80239;TCP;Villages
3;neural-net;Reverse-engineered Creative;Response productivity SAS;Developer;bypass Zloty;Auto Loan Account;63835;analyzer;matrix Field bypassing
4;mint green transmitting;New Zealand maroon hard drive;matrix Lodge;parsing programming capacitor;generate;Sudanese Pound East Caribbean Dollar;36298;SQL;Wooden Investment Account success
5;Ergonomic Frozen Pants;THX Extended Euro;Configuration benchmark;Coordinator Connecticut Supervisor;Cyprus Associate end-to-end;Grenada Hat;16745;Trail Beauty;Berkshire
6;Tasty Cotton Bike;Practical Metal Pizza Home Loan Account;Land users;cyan transmitting payment;Granite dedicated;reboot;51287;portal Money Market Account;navigating uniform Garden
7;Awesome Concrete Shoes applications;Small;Global compressing;hacking hack protocol;monitor Integration models;instruction set;24217;Fantastic Soft Soap monitor;Handmade
8;Principal;Enterprise-wide;override;Generic Cotton Car;Hills system Russian Ruble;Cambridgeshire PNG SMTP;991;haptic;Tasty Soft Shoes website
9;copy Seamless;JBOD exploit;Gorgeous firewall cutting-edge;Graphic Interface;Cross-platform backing up customized;Small Frozen Gloves Integration Concrete;53758;Mouse;Azerbaijan context-sensitive
10;dynamic metrics;Forward Buckinghamshire internet solution;parsing;Handmade Plastic Chips extranet;Chilean Peso Unidades de fomento;solid state Metal withdrawal;12384;Small Frozen Cheese;Licensed Fresh Towels
