id;ordercode;orderstatus;sum;userid;payee;payway;payresult;paytime;concession;rebate;creator;createdate;modifier;modifierdate;modifiernum;logicdelete;other;express_company;express_no
1;mobile Fish;Home Loan Account Table Computer;5808;FTP Savings Account;deposit Tasty Metal Bacon Implementation;Chips;Money Market Account;Albania web-readiness;29122;52477;enable Gorgeous Frozen Pants;Common;Savings Account syndicate Planner;Refined Rubber Chicken Table;6505;false;Usability South Dakota envisioneer;Intelligent;Monitored Bahamian Dollar Investment Account
2;Games Regional Digitized;copy convergence;20794;Georgia Industrial;connect Markets Chief;capacitor archive;sky blue Tasty Plastic Pizza;compress South Georgia and the South Sandwich Islands;58675;35675;mission-critical Faroe Islands Plastic;Car Industrial deliverables;orange Books;magenta monitor 1080p;60595;false;world-class Frozen IB;Highway Ergonomic;moratorium moratorium
3;New York tangible Mississippi;Frozen bus;76078;Idaho compress Avon;system Small;Intelligent Outdoors;Harbor Montana;Corporate Phased relationships;75555;20306;Brand;neutral Salad;Auto Loan Account modular Refined;digital maroon;89255;true;projection Fresh;support Gorgeous;withdrawal
4;copying;ability Hat Iraq;48482;Bahamian Dollar;24/7;Gloves sky blue Oklahoma;robust Engineer;Exclusive Moroccan Dirham card;14808;28484;Computers Personal Loan Account Berkshire;Home;Investor Public-key;Lebanon;44778;true;Persistent Bulgarian Lev;24/7 Re-contextualized cross-platform;invoice withdrawal
5;bypassing optical;installation;18651;Refined Rubber Gloves Algerian Dinar Clothing;open-source turn-key;Sausages;disintermediate Cambridgeshire hacking;bricks-and-clicks Concrete Global;87733;69578;Profound;parsing;Borders content-based;Tasty Customer Human;63310;false;even-keeled Saint Helena Pound;Internal AI optical;bypassing Marketing
6;Dynamic Home Loan Account Tools;Branding;97366;clear-thinking;Latvia;Ports Manager Fish;Networked;Fish;36646;64963;calculating withdrawal Nevada;Berkshire;dedicated Persevering;Coordinator Cambridgeshire Investor;43439;true;Borders North Dakota;CSS Re-contextualized;local Shoes
7;Intelligent Frozen Sausages Villages;Human;37015;Automotive Tactics architectures;Wisconsin Facilitator Incredible;reinvent;eco-centric Bedfordshire mesh;Configuration UIC-Franc;57006;7041;orchid;Director Concrete Bedfordshire;portal calculating Metal;real-time discrete redundant;81011;false;Personal Loan Account Sleek Beauty;digital deposit;extend Unbranded Fresh Pants Tools
8;Practical North Dakota;implementation;15504;Specialist generating;Computers Small Fresh Gloves back-end;interface;compress lavender Investment Account;backing up;19438;53135;Peru deposit;Frozen Analyst card;redundant;content;74404;false;Electronics;Refined infomediaries Som;Salad
9;ROI;Benin;71459;invoice;invoice;alarm Jamaica;system Gorgeous Rubber Pants;hack;1439;34187;Small;Incredible Fresh Chips;Shoes Music connect;Hollow Shoes systems;39850;false;Web HTTP;implement;Optimization Cambridgeshire
10;payment Soap;Web;94425;COM;Data North Dakota;North Carolina Granite;Somalia Web revolutionize;invoice teal analyzing;21458;10077;Books Generic;robust withdrawal generate;Garden open-source hybrid;Solomon Islands Dollar;34833;true;HTTP system mobile;China;quantify multi-byte
