id;userid;withdrawalamount;withdrawaltype;gatheringway;payee;creator;createdate;modifier;modifierdate;modifiernum;logicdelete;other
1;quantify Ergonomic Fresh Salad SCSI;matrices visionary Officer;Awesome Streamlined;4th generation interfaces zero tolerance;COM Norfolk Island Gorgeous Fresh Bike;Avon bandwidth;Lead Vatu;Refined Frozen Towels Beauty North Korean Won;support;43459;false;Rubber customized Table
2;Personal Loan Account;Pike wireless;Progressive Avon;Innovative;Cambridgeshire withdrawal Response;Shoal Analyst;withdrawal;Future;vertical;47249;true;Corporate
3;holistic;Highway Manors Savings Account;Investment Account holistic;Montana;Sports Movies;backing up;Gorgeous web-enabled redundant;tan empower;Response;39701;true;mobile
4;Granite visionary Borders;Health Seychelles Rupee Tasty Cotton Keyboard;clear-thinking disintermediate mindshare;JSON Swedish Krona;Credit Card Account;secured line;Usability calculating Sports;Movies port;Small Rubber Pizza Fiji Dollar Metal;38383;true;withdrawal Rustic
5;architectures reboot;optimize;out-of-the-box;bandwidth payment withdrawal;Home Loan Account Beauty deposit;Rubber Pizza Fish;Soft Global;connecting;Fresh Clothing relationships;29504;false;Awesome integrate
6;Soft Hawaii web-enabled;quantifying Refined Cotton Chicken navigating;Bulgarian Lev interactive;PNG;Flat cross-platform;Terrace Virginia index;success;Tools seamless;interface;68840;true;Bedfordshire Table
7;Steel Legacy;Marketing value-added;withdrawal deposit;optimize redundant;artificial intelligence Uzbekistan Sum;Guinea overriding;Designer Course;Keyboard Analyst Ameliorated;Borders Liaison evolve;3899;false;Regional
8;Shirt Home;Granite Bedfordshire Fresh;Cotton Identity info-mediaries;e-markets Assistant Western Sahara;mission-critical;Shirt Tools Director;Wallis and Futuna Shoes Malawi;Cheese Streamlined;action-items secured line next generation;19462;false;Berkshire
9;contextually-based Assistant Nevada;Towels Connecticut;platforms Auto Loan Account Bedfordshire;mobile circuit;Money Market Account;bluetooth Fall;enable Refined Granite Fish Tunisia;Frozen;Investor array;53338;false;Rustic Soft Cheese British Indian Ocean Territory (Chagos Archipelago) Licensed Metal Ball
10;TCP Usability;Applications;Executive Buckinghamshire;Borders function Bedfordshire;salmon index;Home Loan Account Central;Oregon SCSI;Knolls networks Auto Loan Account;South Dakota Applications;20047;true;Refined Steel Table
