id;userid;withdrawalway;title;withdrawalid;type;amount;afteramount;createdate;modifierdate;state;other
1;system engine;copying;local;FTP South Carolina Human;technologies Regional matrix;Burundi Franc Metal Sleek Rubber Shirt;invoice feed Games;Realigned;deposit Engineer hack;Seychelles Rupee Paradigm attitude-oriented;bluetooth invoice
2;Fantastic;Markets Cambridgeshire;Locks Intelligent;integrated clicks-and-mortar;PNG;architectures;applications program reintermediate;Row THX indigo;quantify Home enable;deposit monitor utilisation;Fantastic Metal Fish Extensions
3;Senior 5th generation;Azerbaijanian Manat bypassing;Borders attitude-oriented calculating;Implemented;next-generation Clothing Frozen;Health interface;Tunisia;24/7 sensor;Associate Iceland Syrian Pound;Springs;override
4;Frozen RAM;Movies navigate;leading-edge Ball synergies;encompassing;firewall Future-proofed withdrawal;Toys monitoring;Virgin Islands, British IB;Toys Internal multi-byte;high-level maroon Gloves;Handmade Concrete Sausages Phased Berkshire;Sleek Metal Car West Virginia Representative
5;haptic;payment invoice Arkansas;sticky Re-contextualized orchid;Investor;virtual Indiana Frozen;New Zealand Regional Chicken;scalable collaborative;B2B sensor Togo;feed;Canadian Dollar;Health deposit Canyon
6;web services;Saint Martin;dot-com;Codes specifically reserved for testing purposes Generic upward-trending;connect Malta Table;Awesome Wooden Pizza Manors;Senior;hacking Strategist haptic;enhance invoice Intelligent;Optimization Administrator;Metrics Mayotte black
7;functionalities Savings Account;orchid;Supervisor;synthesizing;National Quality Markets;Metrics Producer;Pizza Springs;customer loyalty Profit-focused Prairie;Chips Rhode Island program;Checking Account backing up;dynamic Infrastructure Self-enabling
8;Intelligent Soft Gloves Pizza;transmitter Gorgeous;Ameliorated grow;deposit Fresh bottom-line;Agent Metrics;Sleek Soft Shoes expedite;Handmade Automotive;Division;executive Auto Loan Account;Innovative New Hampshire killer;overriding Dynamic
9;Principal Small Cambridgeshire;back up;Industrial;Pizza;context-sensitive Group Oklahoma;New Jersey convergence;program;Plastic;Human Configuration;strategize transmit indexing;Borders teal Illinois
10;empowering;TCP orchid;robust;Accountability;Lake Licensed;backing up parallelism Baht;world-class hacking Cambridgeshire;Aruba discrete;Program embrace;generate Toys;Sleek Plastic Car matrix
